,name,longitude,latitude,cluster,centroids
72553394957,FALLS CITY BRENNER FIELD NE US,-95.59194,40.08028,13,0
72774024135,BUTTE BERT MOONEY AIRPORT MT US,-112.5006,45.9647,10,0
72319093846,ANDERSON FAA AIRPORT SC US,-82.7097,34.4977,15,0
72325003847,CROSSVILLE MEMORIAL AIRPORT TN US,-85.0813,35.9509,0,0
72734714841,PELLSTON REGIONAL AIRPORT MI US,-84.7927,45.5644,0,0
72467494050,MEEKER AIRPORT CO US,-107.88861,40.04417,5,0
72476793069,CORTEZ MONTEZUMA CO AIRPORT CO US,-108.62639,37.30694,5,0
72341503962,HOT SPRINGS ASOS AR US,-93.06,34.29,7,0
72328003894,CLARKSVILLE OUTLAW AIRPORT TN US,-87.41944,36.62389,7,0
72417613736,MORGANTOWN MUNICIPAL AIRPORT WV US,-79.9207,39.64981,0,0
72462593005,DURANGO LA PLATA CO AIRPORT CO US,-107.76028,37.14306,5,0
72427303804,PARKERSBURG AIRPORT WV US,-81.4438,39.3395,0,0
72546194988,MARSHALLTOWN MUNICIPAL AIRPORT IA US,-92.91611,42.11056,13,0
72593023233,SALINAS AIRPORT CA US,-121.6081,36.6636,3,0
72370093167,KINGMAN AIRPORT AZ US,-113.933,35.2577,3,0
72259793985,MINERAL WELLS AIRPORT TX US,-98.0602,32.7816,11,0
72614594705,BARRE MONTPELIER KNAPP STATE AIRPORT VT US,-72.5623,44.2035,12,0
72584793230,SOUTH LAKE TAHOE AIRPORT CA US,-119.9947,38.8983,3,0
72477693075,MOAB CANYONLAND AIRPORT UT US,-109.76278,38.75,5,0
74791593718,NORTH MYRTLE BEACH SC US,-78.72048,33.81619,15,0
72526604751,BRADFORD REGIONAL AIRPORT PA US,-78.6355,41.79835,12,0
72536614825,FINDLAY AIRPORT OH US,-83.66861,41.01361,0,0
72744014858,HANCOCK HOUGHTON CO AIRPORT MI US,-88.48076,47.16594,13,0
72428693824,ZANESVILLE MUNICIPAL AIRPORT OH US,-81.89222,39.94444,0,0
72417713734,MARTINSBURG EASTERN WEST VIRGINIA REGIONAL AIRPORT WV US,-77.945,39.40375,12,0
72622794790,WATERTOWN AIRPORT NY US,-76.02623,43.98867,12,0
72797094240,QUILLAYUTE AIRPORT WA US,-124.555,47.9375,8,0
70296026410,CORDOVA AIRPORT AK US,-145.4511,60.4888,6,0
72483893205,MARYSVILLE AIRPORT ASOS CA US,-121.5677,39.1019,3,0
72297023129,LONG BEACH DAUGHERTY AIRPORT CA US,-118.1463,33.8116,3,0
72586724133,BURLEY MUNICIPAL AIRPORT ID US,-113.7661,42.5416,10,0
72310613744,FLORENCE REGIONAL AIRPORT SC US,-79.73085,34.18772,15,0
72539514833,JACKSON REYNOLDS FIELD MI US,-84.4667,42.2667,0,0
72455503936,MANHATTAN ASOS KS US,-96.6788,39.1346,13,0
72679824150,LIVINGSTON AIRPORT MT US,-110.4408,45.6983,10,0
72253312962,HONDO MUNICIPAL AIRPORT TX US,-99.1742,29.3601,11,0
72576394053,TORRINGTON MUNICIPAL AIRPORT WY US,-104.15846,42.06131,10,0
72782594239,WENATCHEE PANGBORN MEMORIAL AIRPORT WA US,-120.2013,47.3977,8,0
72254203999,BURNET MUNICIPAL AIRPORT TX US,-98.2354,30.7406,11,0
72442013997,VICHY ROLLA NATIONAL AIRPORT MO US,-91.76461,38.1318,13,0
72655614992,REDWOOD FALLS MUNICIPAL AIRPORT MN US,-95.0804,44.5483,13,0
72424303849,LONDON CORBIN AIRPORT KY US,-84.07694,37.08722,0,0
72492623258,MODESTO AIRPORT CA US,-120.9505,37.6241,3,0
72570024046,CRAIG MOFFAT CO AIRPORT CO US,-107.52417,40.49278,10,0
72745594931,HIBBING CHISHOLM HIBBING AIRPORT MN US,-92.83889,47.38639,13,0
72467693073,ASPEN PITKIN CO AIRPORT SARDY FIELD CO US,-106.87056,39.23,5,0
72349513987,JOPLIN REGIONAL AIRPORT MO US,-94.49527,37.15221,11,0
74230024037,MILES CITY AIRPORT MT US,-105.8825,46.4266,10,0
72703314609,HOULTON AIRPORT ME US,-67.7928,46.1185,12,0
70395025325,KETCHIKAN AIRPORT AK US,-131.65,55.35,2,0
72483023232,SACRAMENTO AIRPORT ASOS CA US,-121.495,38.5069,3,0
72622394725,MASSENA INTERNATIONAL AIRPORT NY US,-74.84583,44.93583,12,0
91190022516,KAHULUI AIRPORT HI US,-156.43453,20.88871,4,0
72407513735,MILLVILLE MUNICIPAL AIRPORT NJ US,-75.0778,39.36623,12,0
72248453905,SHREVEPORT DOWNTOWN AIRPORT LA US,-93.745,32.54278,11,0
72655714910,ALEXANDRIA CHANDLER FIELD MN US,-95.39399,45.86801,13,0
72763024012,DICKINSON THEODORE ROOSEVELT REGIONAL AIRPORT ND US,-102.79715,46.79968,10,0
72688624130,BAKER CITY AIRPORT OR US,-117.8086,44.8428,8,0
72564524022,LARAMIE AIRPORT WY US,-105.6833,41.3167,10,0
72476593013,MONTROSE REGIONAL AIRPORT CO US,-107.89889,38.50583,5,0
72753514919,JAMESTOWN MUNICIPAL AIRPORT ND US,-98.6691,46.9258,13,0
74768593874,GULFPORT BILOXI AIRPORT MS US,-89.0808,30.4119,7,0
72362723081,GALLUP MUNICIPAL AIRPORT NM US,-108.794,35.5144,5,0
72429793812,CINCINNATI MUNICIPAL AIRPORT LUNKEN FIELD OH US,-84.41889,39.10333,0,0
72790024141,EPHRATA AIRPORT WA US,-119.5154,47.3078,8,0
91186022534,MOLOKAI KAUNAKAKAI MOLOKAI AIRPORT HI US,-157.0961,21.1545,4,0
78551011624,HENRY E. ROHLSEN AIRPORT VI US,-64.8125,17.6997,9,0
72668624025,PIERRE REGIONAL AIRPORT SD US,-100.2855,44.3813,10,0
78543011640,CYRIL E. KING AIRPORT VI US,-64.98,18.3363,9,0
72792594227,SHELTON AIRPORT WA US,-123.1408,47.238,8,0
72698824219,DALLESPORT AIRPORT WA US,-121.1661,45.6194,8,0
72657994963,MINNEAPOLIS FLYING CLOUD AIRPORT MN US,-93.4705,44.8321,13,0
72248713935,ALEXANDRIA ESLER FIELD LA US,-92.2907,31.3953,7,0
72301003810,HICKORY FAA AIRPORT NC US,-81.38229,35.74207,0,0
72657594960,MINNEAPOLIS CRYSTAL AIRPORT MN US,-93.351,45.0622,13,0
70341025507,HOMER AIRPORT AK US,-151.4908,59.642,6,0
70340025506,ILIAMNA AIRPORT AK US,-154.90902,59.74922,6,0
72252312970,SAN ANTONIO STINSON MUNICIPAL AIRPORT TX US,-98.472,29.3389,11,0
72374023194,WINSLOW AIRPORT AZ US,-110.7208,35.0281,5,0
70259026523,KENAI AIRPORT AK US,-151.2391,60.5797,6,0
72485523153,TONOPAH AIRPORT NV US,-117.0902,38.0511,3,0
72669024057,RAWLINS AIRPORT WY US,-107.2,41.8,10,0
72597524235,SEXTON SUMMIT OR US,-123.3641,42.6003,8,0
72787094119,DEER PARK AIRPORT WA US,-117.4292,47.9742,8,0
72537514822,DETROIT CITY AIRPORT MI US,-83.01,42.40917,0,0
70251026528,TALKEETNA AIRPORT AK US,-150.095,62.32,6,0
72619614610,MILLINOCKET MUNICIPAL AIRPORT ME US,-68.6925,45.6477,12,0
70389425367,KLAWOCK AIRPORT AK US,-133.075,55.58,2,0
70274025331,PALMER AIRPORT AK US,-149.09175,61.59505,6,0
72232012884,BOOTHVILLE ASOS LA US,-89.4075,29.333,7,0
72683524230,REDMOND AIRPORT OR US,-121.1392,44.2558,8,0
72782624141,EPHRATA AIRPORT WA US,-119.5154,47.3078,8,0
78547011624,HENRY E. ROHLSEN AIRPORT VI US,-64.8125,17.6997,9,0
72259613961,FORT WORTH MEACHAM FIELD TX US,-97.36139,32.81917,11,0
72528704724,NIAGARA FALLS INTERNATIONAL AIRPORT NY US,-78.93806,43.10833,12,0
70362025335,SKAGWAY AIRPORT AK US,-135.3239,59.4556,2,0
72342453919,MONTICELLO MUNICIPAL AIRPORT AR US,-91.7556,33.6361,7,0
72234713833,HATTIESBURG CHAIN MUNICIPAL AIRPORT MS US,-89.25306,31.28194,7,0
72764524012,DICKINSON THEODORE ROOSEVELT REGIONAL AIRPORT ND US,-102.7972,46.7994,10,0
72439693989,QUINCY REGIONAL AIRPORT IL US,-91.1919,39.9369,13,0
72781524237,STAMPEDE PASS WA US,-121.3372,47.2767,8,0
72273593026,DOUGLAS BISBEE INTERNATIONAL AIRPORT AZ US,-109.6061,31.4583,5,0
72678524135,BUTTE BERT MOONEY AIRPORT MT US,-112.5006,45.9647,10,0
72263693042,DALHART FAA AIRPORT TX US,-102.55,36.0167,5,0
72243512918,HOUSTON WILLIAM P HOBBY AIRPORT TX US,-95.28194,29.63806,11,0
72326503847,CROSSVILLE MEMORIAL AIRPORT TN US,-85.0813,35.9509,0,0
72235913978,GREENWOOD LEFLORE AIRPORT MS US,-90.0866,33.4963,7,0
72354613969,PONCA CITY MUNICIPAL AIRPORT OK US,-97.10194,36.73667,11,0
72244503904,COLLEGE STATION EASTERWOOD FIELD TX US,-96.36472,30.58917,11,0
72207203894,CLARKSVILLE OUTLAW AIRPORT TN US,-87.41944,36.62389,7,0
70272526491,ANCHORAGE LAKE HOOD SEA PLANE BASE AK US,-149.96639,61.17806,6,0
72658414927,ST. PAUL DOWNTOWN AIRPORT MN US,-93.0558,44.9322,13,0
72312593846,ANDERSON FAA AIRPORT SC US,-82.7097,34.4977,15,0
72206853860,JACKSONVILLE CRAIG MUNICIPAL AIRPORT FL US,-81.5147,30.3361,15,0
72352713975,GAGE AIRPORT OK US,-99.7689,36.2967,11,0
72493593228,HAYWARD AIR TERMINAL CA US,-122.115,37.6542,3,0
70371025333,SITKA AIRPORT AK US,-135.3647,57.0481,2,1
72584523225,BLUE CANYON AIRPORT CA US,-120.7102,39.2774,3,0
72518514750,GLENS FALLS AIRPORT NY US,-73.61028,43.33845,12,0
72348903935,CAPE GIRARDEAU MUNICIPAL AIRPORT MO US,-89.5705,37.2252,7,0
72445613997,VICHY ROLLA NATIONAL AIRPORT MO US,-91.76461,38.1318,13,0
72580524172,LOVELOCK DERBY FIELD AIRPORT NV US,-118.5692,40.0681,3,0
70063727406,DEADHORSE AK US,-148.48005,70.19146,6,0
70362625323,HAINES AIRPORT AK US,-135.5094,59.2433,2,0
72310813776,LUMBERTON REGIONAL AIRPORT NC US,-79.0591,34.608,15,0
72360423007,CHILDRESS MUNICIPAL AIRPORT TX US,-100.2831,34.4272,11,0
72236653865,SLIDELL AIRPORT LA US,-89.82222,30.34333,7,0
72214612816,GAINESVILLE REGIONAL AIRPORT FL US,-82.2755,29.6919,15,0
72344613971,HARRISON BOONE CO AIRPORT AR US,-93.1566,36.2668,7,0
72314503810,HICKORY FAA AIRPORT NC US,-81.38229,35.74207,0,0
72574524057,RAWLINS AIRPORT WY US,-107.2,41.8,10,0
72205612834,DAYTONA BEACH INTERNATIONAL AIRPORT FL US,-81.0483,29.1828,15,0
72493623254,CONCORD BUCHANAN FIELD CA US,-122.055,37.9917,3,0
72491723233,SALINAS AIRPORT CA US,-121.6081,36.6636,3,0
72202512849,FORT LAUDERDALE INTERNATIONAL AIRPORT FL US,-80.16217,26.07875,15,0
78535011630,ROOSEVELT ROADS PR US,-65.6411,18.2552,9,1
72785494119,DEER PARK AIRPORT WA US,-117.4292,47.9742,8,0
72235613939,GREENVILLE ASOS MS US,-90.98528,33.4825,7,0
72220012832,APALACHICOLA AIRPORT FL US,-85.02481,29.72681,15,0
72352603932,CLINTON SHERMAN AIRPORT OK US,-99.2042,35.3568,11,0
99999940710,MAJURO WBAS AIRPORT MH RM,171.27203,7.06497,1,0
91408040309,KOROR WEATHER SERVICE OFFICE PW PS,134.48333,7.33333,14,0
91413040308,YAP ISLAND WEATHER SERVICE OFFICE AIRPORT FM FM,138.08333,9.48333,14,1
91334040505,CHUUK WEATHER SERVICE OFFICE AIRPORT FM FM,151.85,7.46666,1,0
91408140309,KOROR WEATHER SERVICE OFFICE PW PS,134.48333,7.33333,14,0
99999940504,POHNPEI WEATHER SERVICE OFFICE FM FM,158.2167,6.9667,1,1
91366040604,KWAJALEIN MH RM,167.73333,8.73333,1,0
72691724284,NORTH BEND SOUTHWEST OREGON REGIONAL AIRPORT OR US,-124.24361,43.41333,8,0
72571703016,RIFLE GARFIELD CO AIRPORT CO US,-107.71972,39.52778,5,0
91765061705,PAGO PAGO WEATHER SERVICE OFFICE AIRPORT AS AQ,-170.71361,-14.33056,4,0
